{
  "provider": "anthropic",
  "plugin": "anthropic",
  "model": "claude-3-sonnet-20240229",
  "config": {
    "temperature": 0.75,
    "max_tokens": 500,
    "top_k": 40,
    "top_p": 0.9,
    "timeout": 10
  },
  "plugin_config": {
    "api_key_env_var": "ANTHROPIC_API_KEY",
    "api_url": null
  }
}
